title,publishedAt,duration,views,likes,comments,duration_sec,publish_hour,publish_day,cluster
Claude Code is Amazing!,2025-08-01 16:15:06+00:00,PT20M40S,116023,3900,405,1240.0,16,Friday,1
I Tried Devin - First AI Software Engineer | It Will Replace Your Software Jobs?,2025-07-30 06:56:28+00:00,PT24M49S,413784,10252,1549,1489.0,6,Wednesday,1
SQL Tutorial for Beginners (Complete Course using MySQL),2025-07-13 15:48:18+00:00,PT3H57M54S,481106,16140,1644,14274.0,15,Sunday,1
Your First Programming Language in the AI Era Should be...,2025-07-05 11:30:20+00:00,PT12M29S,651993,23946,1862,749.0,11,Saturday,1
You can do much more with AI 🔥,2025-07-03 13:30:28+00:00,PT10M49S,141941,6814,412,649.0,13,Thursday,1
AI & Machine Learning Roadmap (No Fluff),2025-06-22 06:18:43+00:00,PT13M5S,383297,16167,1224,785.0,6,Sunday,1
The Shocking History of AI and Machine Learning! - Journey since 1939 🔥,2025-06-14 15:43:44+00:00,PT10M10S,160306,5921,516,610.0,15,Saturday,1
How to Win in the AI Era (Do this)!,2025-06-09 13:15:07+00:00,PT15M10S,427395,17282,970,910.0,13,Monday,1
We Need to Talk!,2025-06-01 13:02:42+00:00,PT18M30S,694393,28315,2468,1110.0,13,Sunday,1
Trae AI – The Smartest AI IDE + MCP Tool for Developers,2025-05-29 11:30:22+00:00,PT14M10S,184038,4621,365,850.0,11,Thursday,1
Top E-Commerce Growth Hacks for 2025 for Programmers (That Actually Work)🔥,2025-05-25 15:30:25+00:00,PT7M53S,28772,1254,141,473.0,15,Sunday,1
This AI Voice Assistant feels so Human (Real Talking Human) 🔥,2025-05-24 11:30:35+00:00,PT17M15S,53460,2446,218,1035.0,11,Saturday,1
Let's Try YouWare: Free & Online Vibe Coding Tool 🔥,2025-05-22 13:30:33+00:00,PT17M31S,66706,2563,250,1051.0,13,Thursday,1
"Lets Vibe Code a Pdf Merger Application using Clerk, Cursor AI and Next.js🔥",2025-05-17 15:16:59+00:00,PT35M3S,30114,1067,165,2103.0,15,Saturday,1
Complete Python Programming Roadmap (Zero to Expert) 🐍,2025-05-09 12:51:50+00:00,PT12M52S,622880,24606,1263,772.0,12,Friday,1
Is Vibe Coding future of Programming | Vibe Coding Hackathon 2025 🔥,2025-05-01 16:02:21+00:00,PT8M31S,79841,3669,530,511.0,16,Thursday,1
Top Skills Every Software Engineer Should Learn in 2025 🔥,2025-04-30 13:06:46+00:00,PT15M20S,592666,20283,1030,920.0,13,Wednesday,1
The Complete Data Science Roadmap (Get Hired in 2025),2025-04-24 13:53:12+00:00,PT15M27S,531833,21085,1401,927.0,13,Thursday,1
Vibe Coding Secrets for Maximum Productivity 🔥,2025-04-20 14:45:04+00:00,PT13M11S,96272,4285,382,791.0,14,Sunday,1
Biggest Announcement!!! 📢📢📢,2025-04-09 13:52:12+00:00,PT11M51S,662896,32763,5471,711.0,13,Wednesday,1
What is Vibe Coding? What will happen to Developers now?,2025-03-29 06:42:29+00:00,PT20M32S,209996,7911,597,1232.0,6,Saturday,1
GitHub Copilot is Insane?,2025-03-20 12:00:50+00:00,PT20M22S,75039,2127,274,1222.0,12,Thursday,1
Your B.Tech/BCA/B.Sc. degree - Does it matter? Which one to Choose?,2025-03-14 15:30:23+00:00,PT10M16S,473231,23005,2062,616.0,15,Friday,1
Cursor AI Tutorial - My Personal Tips & Tricks (AI Code Editor),2025-03-07 05:49:25+00:00,PT37M32S,654193,18886,969,2252.0,5,Friday,1
Automate Tasks with Pre-Built AI Agents | n8n Tutorial 🔥,2025-03-04 15:10:17+00:00,PT15M47S,154735,4284,214,947.0,15,Tuesday,1
How to Build a Realistic Clothing Store for E-commerce using Wordpress + Email Marketing 🔥,2025-03-01 12:01:15+00:00,PT34M26S,70185,2657,192,2066.0,12,Saturday,1
Claude 3.7 Thinking is INSANE🔥 #coding #ai #claude,2025-02-28 11:30:07+00:00,PT58S,184900,11065,228,58.0,11,Friday,1
Best way to implement Auth in Next.js 15 - Step by Step Clerk Guide 🔥,2025-02-20 13:58:04+00:00,PT36M23S,30406,934,175,2183.0,13,Thursday,1
Will AI replace Software Developers?,2025-02-17 13:49:16+00:00,PT17M51S,279074,11093,887,1071.0,13,Monday,1
Amazing VS code Extension 🔥#nextjs #webdevelopment,2025-02-17 08:06:34+00:00,PT40S,207696,13735,76,40.0,8,Monday,1
What is Grafana - Installation using Docker & Use cases 🔥,2025-02-16 13:53:41+00:00,PT13M32S,33228,1069,115,812.0,13,Sunday,1
Horizontal vs Vertical Scaling 🔥,2025-02-15 13:50:40+00:00,PT58S,91949,5561,43,58.0,13,Saturday,1
AI software developer 😯,2025-02-10 07:10:02+00:00,PT59S,214190,17914,244,59.0,7,Monday,1
This FREE AI can create your Apps in seconds | Let's Try Replit Agent 🤖,2025-02-08 11:30:03+00:00,PT19M47S,638308,20360,1107,1187.0,11,Saturday,1
Lets build a peer-to-peer Pong game using Pears 🍐,2025-02-07 12:01:46+00:00,PT12M15S,27524,1074,125,735.0,12,Friday,1
Make Money From Blogging in 2025 (Easier than ever!),2025-02-05 16:00:31+00:00,PT9M15S,156554,5802,286,555.0,16,Wednesday,1
"Lets Build a Password Manager using Next.js, Clerk, Tailwind CSS and Shadcn UI 🔥",2025-02-03 14:22:47+00:00,PT1H54M46S,37550,1463,154,6886.0,14,Monday,1
"Ditch ChatGPT, Run Deepseek R1 like this (FREE!!)",2025-01-31 15:00:35+00:00,PT11M9S,133168,5399,431,669.0,15,Friday,1
Deepseek - a cheater? (Exposed),2025-01-30 09:32:28+00:00,PT8M3S,443416,18863,1879,483.0,9,Thursday,1
An Amazing AI Tool For Data Analysis 🔥,2025-01-29 15:30:00+00:00,PT17M17S,103842,4653,311,1037.0,15,Wednesday,1
Unbelievable Move by Deepseek | Beats DALLE-3! (How To Use for Free),2025-01-29 05:03:49+00:00,PT4M6S,211826,8490,720,246.0,5,Wednesday,1
DeepSeek R1: Is Your Job in Danger? (The Truth),2025-01-28 05:12:35+00:00,PT16M39S,726826,30927,2221,999.0,5,Tuesday,1
Learn Wordpress in 2025 - Here's Why!,2025-01-26 11:30:19+00:00,PT10M52S,206848,6863,511,652.0,11,Sunday,1
AI for Data Science🔥,2025-01-25 11:30:05+00:00,PT52S,238374,16966,145,52.0,11,Saturday,1
Python Pandas Crash Course (2025),2025-01-24 12:18:01+00:00,PT36M57S,187838,6510,1842,2217.0,12,Friday,1
Web Developer Roadmap (2025) - Everything is Changing,2025-01-21 04:06:32+00:00,PT21M48S,1615256,60460,2482,1308.0,4,Tuesday,0
Creating a Wordpress Travel Blog in less than 10 Minutes 🔥,2025-01-13 17:48:03+00:00,PT13M35S,36814,1371,197,815.0,17,Monday,1
"Let's build a Chat app using Clerk, Stream & Next.js 🔥",2025-01-10 14:30:05+00:00,PT1H42M26S,52340,1968,306,6146.0,14,Friday,1
Learn Coding & Get a Job (in 2025) 🔥,2025-01-08 13:24:58+00:00,PT16M54S,3250254,135578,4711,1014.0,13,Wednesday,0
CodeWithHarry 2024 Rewind 🔥,2024-12-29 11:30:33+00:00,PT5M44S,59865,4972,863,344.0,11,Sunday,1
Upcoming Products (Google Insider Reveals),2024-12-29 05:30:04+00:00,PT33S,61415,2796,18,33.0,5,Sunday,1
Security & Google 🔥,2024-12-27 12:01:05+00:00,PT58S,145800,8687,47,58.0,12,Friday,1
Two Weeks is what it takes...,2024-12-25 12:48:27+00:00,PT5M18S,231715,15665,767,318.0,12,Wednesday,1
"Why use Google Workspace ft. Prakash, India Lead Customer Engineering at Google 🔥",2024-12-23 12:32:09+00:00,PT47S,69604,2498,35,47.0,12,Monday,1
Top 3 Skills every Data Scientist must have 🔥,2024-12-20 14:06:12+00:00,PT1M,317520,21606,77,60.0,14,Friday,1
AI for Academic Research 🔥,2024-12-19 15:22:04+00:00,PT12M7S,31150,1417,183,727.0,15,Thursday,1
Get GitHub Copilot - Free!!!,2024-12-19 13:38:08+00:00,PT1M,186630,10434,105,60.0,13,Thursday,1
How to Integrate AI in your Backend using CopilotKit | CopilotKit Backend Actions Tutorial 🔥,2024-12-19 06:27:07+00:00,PT20M,36116,1379,179,1200.0,6,Thursday,1
How to Make 2025 the Best Year of Your Life 🔥,2024-12-18 11:30:31+00:00,PT8M49S,168081,9453,379,529.0,11,Wednesday,1
Top Skills Every Software Engineer Should Learn in 2025,2024-12-15 11:30:29+00:00,PT9M31S,636117,22431,830,571.0,11,Sunday,1
How To Make Money With AI (More than you think),2024-12-13 14:22:00+00:00,PT14M4S,401790,15494,635,844.0,14,Friday,1
5 Mistakes Beginner Web Developers Make (Avoid These),2024-12-11 11:30:02+00:00,PT12M9S,226034,11960,566,729.0,11,Wednesday,1
"How to use AI Effectively - Prompts, Tips & Tricks🔥",2024-12-07 12:48:52+00:00,PT14M30S,110374,6694,348,870.0,12,Saturday,1
"Should You Learn AWS, DevOps & Cloud Computing in 2025?",2024-12-06 11:30:28+00:00,PT8M47S,382399,12760,707,527.0,11,Friday,1
How to Start an E-Commerce Business in India? (Complete Guide),2024-12-04 11:30:36+00:00,PT19M7S,397027,16488,505,1147.0,11,Wednesday,1
How to Build an Ecommerce Website in 15 Minutes (2025) 🔥,2024-11-30 11:30:28+00:00,PT15M55S,150684,5244,525,955.0,11,Saturday,1
Top Skill to Learn in 2025 🔥,2024-11-27 11:32:45+00:00,PT1M,631325,52958,390,60.0,11,Wednesday,0
Must Use Python libraries for Data Analysis 🔥,2024-11-24 11:30:25+00:00,PT8M7S,48254,1920,227,487.0,11,Sunday,1
What Do Software Engineers Actually Do? (It’s Not What You Think),2024-11-21 11:30:15+00:00,PT13M7S,291138,12462,624,787.0,11,Thursday,1
How I would learn to code (If I could start over),2024-11-18 11:30:25+00:00,PT13M14S,290988,16419,827,794.0,11,Monday,1
Ultimate WordPress Tutorial 2025: Build Your Site in Just 40 Minutes! 🔥,2024-11-15 13:18:27+00:00,PT41M31S,513739,13295,764,2491.0,13,Friday,1
My Last Video | Sigma Web Development Course - Tutorial #139,2024-11-11 11:30:25+00:00,PT8M27S,531825,35671,3005,507.0,11,Monday,1
Deploying our Next.js App to Vercel | Sigma Web Development Course - Tutorial #138,2024-11-10 05:30:11+00:00,PT18M58S,76492,1486,228,1138.0,5,Sunday,1
Ultimate Web Scraping tutorial,2024-11-08 11:30:02+00:00,PT41M31S,123432,3217,215,2491.0,11,Friday,1
[Project] Let's Build a LinkTree Clone in Next.js 15 | Sigma Web Development Course - Tutorial #137,2024-11-05 14:46:33+00:00,PT1H53M49S,72881,1349,200,6829.0,14,Tuesday,1
[Project] Let's Build a Url Shortener in Next.js 15 | Sigma Web Development Course - Tutorial #136,2024-11-03 15:21:38+00:00,PT56M16S,61528,1476,223,3376.0,15,Sunday,1
Add AI to your Existing Applications using this AI Tool 🔥,2024-10-24 11:30:27+00:00,PT20M56S,40494,1513,192,1256.0,11,Thursday,1
Styled JSX and other ways to Style in Next.js | Sigma Web Development Course - Tutorial #135,2024-10-21 11:30:23+00:00,PT8M34S,29422,969,211,514.0,11,Monday,1
The Best Network monitoring and device blocking app for PC and mobile | Trying the Fing Wifi app 🔥,2024-10-20 11:30:37+00:00,PT16M56S,34772,1164,127,1016.0,11,Sunday,1
Environment Variables in Next.js | Sigma Web Development Course - Tutorial #134,2024-10-19 12:47:37+00:00,PT11M15S,22908,922,167,675.0,12,Saturday,1
This AI Image API is amazing!,2024-10-18 11:30:36+00:00,PT28M10S,27008,1109,103,1690.0,11,Friday,1
"SSR, SSG & ISR in Next.js | Sigma Web Development Course - Tutorial #133",2024-10-17 14:30:11+00:00,PT14M18S,31274,1291,241,858.0,14,Thursday,1
Is AI & ML Worth the Hype?,2024-10-16 14:15:47+00:00,PT11M14S,152027,6449,511,674.0,14,Wednesday,1
Understanding next/navigation module in Next.js | Sigma Web Development Course - Tutorial #132,2024-10-15 11:30:12+00:00,PT12M50S,23831,933,213,770.0,11,Tuesday,1
Strapi 5 Crash Course for Beginners 🔥,2024-10-11 11:30:09+00:00,PT1H15M22S,42054,991,142,4522.0,11,Friday,1
AI for Testing 🔥,2024-10-10 17:00:37+00:00,PT53S,69256,3753,60,53.0,17,Thursday,1
How to Scrape Amazon Using AI (with least manual coding) 🔥,2024-10-10 11:30:27+00:00,PT12M31S,19069,763,107,751.0,11,Thursday,1
Host & Test Free Llama Models on your own Server + Kusho AI for Gen AI Testing,2024-10-09 11:30:19+00:00,PT15M44S,20264,770,97,944.0,11,Wednesday,1
I Built an AI Agent to Help me Get a Job 🔥,2024-10-06 05:30:21+00:00,PT22M54S,37917,1637,144,1374.0,5,Sunday,1
How to Build a Website in 10 Minutes Using WordPress & AI (No Coding Required)🔥,2024-10-05 05:30:06+00:00,PT11M32S,106857,2841,220,692.0,5,Saturday,1
AI assisted academic writing 🔥 #ai_thor,2024-10-04 12:13:52+00:00,PT56S,84066,7746,50,56.0,12,Friday,1
Should You Learn Multiple Programming Languages? (The Truth),2024-10-03 11:30:24+00:00,PT8M29S,139043,6546,731,509.0,11,Thursday,1
Best Data Analyst Learning Resources in 2025,2024-09-29 11:00:21+00:00,PT10M17S,286963,10935,450,617.0,11,Sunday,1
HTML Full Course (in Hindi),2024-09-28 12:56:12+00:00,PT2H39M30S,1475605,34252,5288,9570.0,12,Saturday,0
Instagram Comments & Posts Automation using Make 🔥,2024-09-26 11:57:50+00:00,PT16M47S,29940,1171,137,1007.0,11,Thursday,1
I Created SEO Friendly Blogs using AI (Experiment),2024-09-24 11:30:07+00:00,PT19M28S,65989,2309,194,1168.0,11,Tuesday,1
India's E-Commerce Tech #meesho #api #coding #tech,2024-09-13 11:30:04+00:00,PT58S,73249,5348,84,58.0,11,Friday,1
Complete CyberSecurity Roadmap 2025 (Beginner's Guide),2024-09-11 11:46:10+00:00,PT15M4S,457023,18974,850,904.0,11,Wednesday,1
How I Created AI Agents That Do My Work For Me 🔥,2024-09-08 05:30:11+00:00,PT21M40S,342496,10006,557,1300.0,5,Sunday,1
"Lets build a Markdown blog using Next.js, Shadcn, Tailwind, Pieces, Remark & Rehype 🔥",2024-09-05 14:24:12+00:00,PT2H29M50S,97764,2401,274,8990.0,14,Thursday,1
Fastest Way to Build an E-Commerce Website (For now) 🔥,2024-09-04 05:30:02+00:00,PT22M58S,59562,2210,276,1378.0,5,Wednesday,1
College doesn't teach you the skills needed in the industry #skillsmatter  #simplilearn,2024-08-30 10:56:48+00:00,PT57S,416750,13907,289,57.0,10,Friday,1
What is low-code? | Let's build a low-code app with Zoho Creator,2024-08-29 14:30:06+00:00,PT24M30S,2232860,28634,268,1470.0,14,Thursday,0
TRUTH about Colleges!,2024-08-28 11:59:40+00:00,PT9M22S,96193,5679,670,562.0,11,Wednesday,1
Predis.AI: Your Social Media Co-Pilot 🔥,2024-08-24 02:30:05+00:00,PT1M,71327,5791,67,60.0,2,Saturday,1
What is an Anti Detection Browser | Anti Detection browser demo using Gologin Browser  🔥,2024-08-23 06:00:30+00:00,PT10M46S,58039,1691,194,646.0,6,Friday,1
Which Technology to use for Game Development?,2024-08-21 05:55:29+00:00,PT6M50S,49219,2597,280,410.0,5,Wednesday,1
Python vs JavaScript | What to Choose? | ft. Toolify.ai,2024-08-19 07:11:49+00:00,PT9M23S,331111,11911,659,563.0,7,Monday,1
Generative AI Roadmap For Absolute Beginners 🔥,2024-08-17 07:31:31+00:00,PT15M13S,515537,17459,889,913.0,7,Saturday,1
2024 Generative AI Roadmap For Absolute Beginners 🔥,2024-08-17 05:30:06+00:00,PT15M19S,14713,1181,183,919.0,5,Saturday,1
How to build a Website using Wordpress & AI in 5 Minutes?,2024-08-14 02:30:06+00:00,PT10M13S,144804,3754,274,613.0,2,Wednesday,1
Make AI Text Sound Human(Free AI) #coding #aitools #aidetection #aihumanizer,2024-08-13 15:55:22+00:00,PT1M1S,69235,5226,78,61.0,15,Tuesday,1
AI Advertisements: Url to Video Ad using @joggai,2024-08-11 11:30:32+00:00,PT59S,114948,10283,87,59.0,11,Sunday,1
"How much HTML, CSS and JavaScript is Enough to get a Job 🔥",2024-08-08 14:30:06+00:00,PT14M32S,551623,24388,1046,872.0,14,Thursday,1
AI Coding Buddy: AI Assistance Like a Friend Beside You | Pieces for Developers,2024-08-07 11:30:31+00:00,PT15M30S,81324,3802,583,930.0,11,Wednesday,1
Which Operating System I use and Why 💻,2024-08-05 14:30:18+00:00,PT14M57S,248067,9038,1376,897.0,14,Monday,1
How to Build an E-Commerce Website in 15 Minutes | eCommerce Hosting by Elementor 🔥,2024-07-31 17:29:21+00:00,PT16M37S,53549,2052,297,997.0,17,Wednesday,1
Can AI Create Video Ads? - Let's Find out! | URL to Ads using @joggai,2024-07-30 11:30:11+00:00,PT21M30S,81638,2828,224,1290.0,11,Tuesday,1
Microsoft Special Boarding Pass ✈️,2024-07-20 11:42:58+00:00,PT57S,795969,53150,348,57.0,11,Saturday,0
Amazing AI for your Desktop 🔥,2024-07-17 14:41:22+00:00,PT1M,401678,37797,236,60.0,14,Wednesday,1
How to become a Data Analyst? | Complete Roadmap for Data Analyst🔥,2024-07-16 11:30:17+00:00,PT15M20S,1145262,39970,1448,920.0,11,Tuesday,0
C Language Tutorial for Beginners (With Notes + Surprise) 🔥,2024-07-09 15:25:30+00:00,PT10H3M19S,4571524,81157,35471,36199.0,15,Tuesday,2
Write Undetectable AI & Plagiarism-Free Essays Online with the Best AI Essay Writing Copilot 🔥,2024-07-01 11:30:12+00:00,PT9M,39871,1200,324,540.0,11,Monday,1
Project Management Roadmap for Beginners | Project Management Learning Path For 2025 🔥,2024-06-29 05:30:07+00:00,PT16M37S,238999,7270,416,997.0,5,Saturday,1
Selenium Tutorial for Beginners using Python | Selenium for Web Scraping (With Project),2024-06-26 12:05:02+00:00,PT36M55S,222268,4534,365,2215.0,12,Wednesday,1
MalCare: WordPress Security for High Performance Websites,2024-06-23 11:30:06+00:00,PT11M53S,18504,669,149,713.0,11,Sunday,1
Create Undetectable AI Content Online with this tool 🔥,2024-06-21 11:30:27+00:00,PT8M23S,51296,2294,261,503.0,11,Friday,1
Python Tutorial For Beginners in Hindi | Complete Python Course 🔥,2024-06-16 05:36:24+00:00,PT10H53M55S,11743038,256016,33997,39235.0,5,Sunday,2
Let's Build an E-Commerce Website using WordPress | ShopPress E-Commerce Tutorial 🔥,2024-06-09 11:30:07+00:00,PT36M23S,87111,2330,258,2183.0,11,Sunday,1
"Docker in 2025 | Docker Scout, Docker Build Cloud, Docker Debug & many more new features 🔥",2024-05-25 10:48:01+00:00,PT28M45S,58230,1545,325,1725.0,10,Saturday,1
How to make an E-commerce Website in 10 Minutes (Grocery Online Store) | WordPress Ecommerce Website,2024-05-20 07:41:17+00:00,PT9M59S,134989,3104,289,599.0,7,Monday,1
This is How Hackers Crack Passwords! (Don't Try),2024-05-19 07:24:10+00:00,PT8M27S,2661049,55856,1922,507.0,7,Sunday,0
Train Your Own Custom AI Chatbot on Custom Data - CustomGPT Tutorial 🔥,2024-05-17 14:25:42+00:00,PT14M51S,70241,2443,204,891.0,14,Friday,1
A Mystery box from a Tech Brand | BenQ RD240Q Review🔥,2024-05-16 16:02:09+00:00,PT10M15S,35594,1477,132,615.0,16,Thursday,1
AI & ML Roadmap - Complete Roadmap for Machine Learning + PDF Download📜,2024-05-11 12:00:07+00:00,PT8M40S,736259,27320,990,520.0,12,Saturday,1
AI based Driverless Taxi (No Driver) | Real life Tarzan the wonder car!,2024-05-07 10:13:56+00:00,PT51S,1439582,54476,729,51.0,10,Tuesday,0
Job Advice from an Oracle Hiring Manager (Silicon Valley),2024-05-04 11:30:01+00:00,PT18M12S,163636,6822,380,1092.0,11,Saturday,1
"Microsoft Girl in the US talks about AI, DSA and life in the US 🔥",2024-05-02 17:34:11+00:00,PT21M41S,233644,7392,437,1301.0,17,Thursday,1
"Jensen Huang on AI, work-life balance, success, and more 🔥",2024-04-29 07:50:52+00:00,PT10M42S,107199,4410,295,642.0,7,Monday,1
Future of AI ft. Indian Developer in USA @SinghInUSA,2024-04-26 16:50:02+00:00,PT7M56S,143325,5539,402,476.0,16,Friday,1
The  Ultimate Python Programming Roadmap (Before you Start)🐍,2024-04-24 11:30:07+00:00,PT11M39S,1054003,40149,1317,699.0,11,Wednesday,0
Tutorial: Create a WordPress eCommerce Website for Beginners 🔥,2024-04-23 14:30:31+00:00,PT3H7M17S,236765,5796,777,11237.0,14,Tuesday,1
Complete 2024 Roadmap to Become a Data Scientist,2024-04-21 11:30:18+00:00,PT23M51S,851094,32203,2553,1431.0,11,Sunday,1
Project GetMeAChai - Patreon Clone in Next.js | Sigma Web Development Course - Tutorial #131,2024-04-20 14:21:47+00:00,PT4H49M2S,274916,4932,943,17342.0,14,Saturday,1
Build WooCommerce store & integrate email marketing to boost sales +40%,2024-04-17 14:04:44+00:00,PT10M27S,11400,399,84,627.0,14,Wednesday,1
Building Peer-to-Peer Applications using Pears!,2024-04-15 11:30:19+00:00,PT11M56S,23107,877,166,716.0,11,Monday,1
5 Things I am doing to Beat AI (Copy These!) 💥,2024-04-11 15:17:22+00:00,PT6M,250342,10362,626,360.0,15,Thursday,1
Speed up your WordPress Website in 1 Click! (5X Faster),2024-04-10 12:05:02+00:00,PT5M38S,23445,893,156,338.0,12,Wednesday,1
How to Make a Professional Website using AI in 10 Minutes!,2024-04-08 12:17:23+00:00,PT19M28S,159178,5538,344,1168.0,12,Monday,1
"Profitable Web Developer RoadMap - Step by Step | Freelancing, Jobs & AI in Web Development 🔥",2024-04-05 05:30:18+00:00,PT13M53S,942115,42514,1456,833.0,5,Friday,0
Let's build an Amazon price tracker using React & Python 🔥,2024-04-03 11:30:27+00:00,PT1H8M13S,49863,1792,225,4093.0,11,Wednesday,1
GitHub Copilot - FREE Forever!! (Legal Way),2024-04-01 11:30:20+00:00,PT5M,197944,7432,627,300.0,11,Monday,1
5 Things I Wish I Knew When I Started Programming (Honest Truth),2024-03-29 17:56:59+00:00,PT9M7S,149162,9037,619,547.0,17,Friday,1
Run your own AI (but private),2024-03-28 11:30:17+00:00,PT3M51S,106724,6327,1463,231.0,11,Thursday,1
AI Killed Web Development - The Reality (Honest Truth) 😢,2024-03-24 11:35:52+00:00,PT21M48S,421094,19478,2243,1308.0,11,Sunday,1
💥Windows vs Linux vs Mac - End of Debate (Eye-Opening) 💥,2024-03-23 05:36:50+00:00,PT10M49S,299121,8766,2214,649.0,5,Saturday,1
Devin is here - This is the end ☠️,2024-03-20 06:37:17+00:00,PT11M56S,561035,26266,2796,716.0,6,Wednesday,1
➡️ You Must Try This IDE! 🤯,2024-03-19 12:24:23+00:00,PT9M44S,34910,1353,155,584.0,12,Tuesday,1
"React Project: Password Manager using React, Tailwind, MongoDB & Express | Sigma WebD Tutorial #130",2024-03-18 12:33:11+00:00,PT2H28M15S,242369,4593,823,8895.0,12,Monday,1
🎮 How to Become a Game Developer | Complete Roadmap for Game Development 🎮,2024-03-17 05:30:16+00:00,PT9M48S,877107,31057,1384,588.0,5,Sunday,1
Benefits of Coding 🔥🔥,2024-03-16 08:14:54+00:00,PT1M1S,316220,20430,258,61.0,8,Saturday,1
Use WordPress & WooCommerce in 2025 AI Era - Here's Why! (Eye Opening),2024-03-15 05:30:05+00:00,PT10M6S,286419,6257,586,606.0,5,Friday,1
How To Become an Ethical Hacker? | CyberSecurity Roadmap 2024 (Beginner's Guide),2024-03-13 16:26:57+00:00,PT11M14S,578559,26697,2536,674.0,16,Wednesday,1
Make Money 💰,2024-03-13 14:11:11+00:00,PT49S,127432,10895,72,49.0,14,Wednesday,1
5 Ways to Make Money from Coding 💰💵,2024-03-12 15:14:59+00:00,PT58S,279263,22731,100,58.0,15,Tuesday,1
Learn this Programming Language in 2024 👨‍💻,2024-03-11 08:52:01+00:00,PT58S,252591,21115,172,58.0,8,Monday,1
Coding Without a Degree?,2024-03-09 20:24:56+00:00,PT48S,469647,37588,494,48.0,20,Saturday,1
Java in 2024❓,2024-03-08 07:18:58+00:00,PT58S,173944,14344,134,58.0,7,Friday,1
Best Framework for Web Development - The Bitter Truth 😒,2024-03-07 13:18:50+00:00,PT11M25S,133071,5417,557,685.0,13,Thursday,1
Layouts in Next.js | Sigma Web Development Course - Tutorial #129,2024-03-05 05:30:10+00:00,PT12M34S,65592,2042,345,754.0,5,Tuesday,1
Amazing Learning Trick 🔥,2024-03-04 17:00:37+00:00,PT55S,142395,14871,129,55.0,17,Monday,1
Dynamic Routes in Next.js | Sigma Web Development Course - Tutorial #128,2024-03-04 11:48:54+00:00,PT9M51S,53912,1782,312,591.0,11,Monday,1
Auth.js - Authentication in Next.js | Sigma Web Development Course - Tutorial #127,2024-03-03 13:45:50+00:00,PT14M4S,72028,2116,244,844.0,13,Sunday,1
PHP in 2024?,2024-03-03 07:33:35+00:00,PT58S,280994,20300,186,58.0,7,Sunday,1
Middleware in Next.js | Sigma Web Development Course - Tutorial #126,2024-03-02 15:05:23+00:00,PT10M18S,43082,1680,144,618.0,15,Saturday,1
DSA & ₹1.2 Crore Per Annum Jobs - The Truth? (No Offence),2024-02-28 15:37:09+00:00,PT12M22S,913600,35346,1497,742.0,15,Wednesday,1
Server Actions in Next.js | Sigma Web Development Course - Tutorial #125,2024-02-28 05:30:10+00:00,PT13M16S,51009,2016,239,796.0,5,Wednesday,1
Creating APIs in Next.js | Sigma Web Development Course - Tutorial #124,2024-02-27 11:30:01+00:00,PT7M48S,59349,1929,142,468.0,11,Tuesday,1
How To Get Rich & Financially Independent (Works in 2025),2024-02-25 05:30:00+00:00,PT15M49S,825307,43464,1543,949.0,5,Sunday,0
"Script, Link & Image components in Next.js | Sigma Web Development Course - Tutorial #123",2024-02-24 11:30:33+00:00,PT20M37S,55887,2084,206,1237.0,11,Saturday,1
Server Components in Next.js | Sigma Web Development Course - Tutorial #122,2024-02-23 11:30:16+00:00,PT11M12S,51752,2189,238,672.0,11,Friday,1
Introduction to Next.js & File based routing | Sigma Web Development Course - Tutorial #121,2024-02-22 11:52:23+00:00,PT12M25S,94987,3271,294,745.0,11,Thursday,1
Learn Redux in One video | Sigma Web Development Course - Tutorial #120,2024-02-21 15:44:53+00:00,PT19M37S,139372,4428,280,1177.0,15,Wednesday,1
Handling Forms + Connecting React to Express Backend | Sigma Web Development Course - Tutorial #119,2024-02-20 13:43:27+00:00,PT31M29S,101712,2983,259,1889.0,13,Tuesday,1
The useCallback hook in React | Sigma Web Development Course - Tutorial #118,2024-02-18 11:30:07+00:00,PT14M,87410,3239,290,840.0,11,Sunday,1
The useMemo hook in React | Sigma Web Development Course - Tutorial #117,2024-02-17 11:30:25+00:00,PT14M49S,81418,3192,302,889.0,11,Saturday,1
The useContext hook in React | Sigma Web Development Course - Tutorial #116,2024-02-16 11:30:17+00:00,PT16M17S,120644,3993,287,977.0,11,Friday,1
One Effective Trick to Learn Coding Fast (Works in 2025),2024-02-15 15:19:35+00:00,PT4M53S,386318,17770,434,293.0,15,Thursday,1
React Router: Routing in React | Sigma Web Development Course - Tutorial #115,2024-02-14 14:47:22+00:00,PT17M,217636,5517,364,1020.0,14,Wednesday,1
"TodoList App using React, Tailwind & React Icons | Sigma Web Development Course - Tutorial #114",2024-02-14 05:30:13+00:00,PT1H21M55S,193911,3754,511,4915.0,5,Wednesday,1
Logic Building in Programming - 5 Proven Strategies (2025) 🔥,2024-02-12 11:47:41+00:00,PT13M1S,655883,30464,1486,781.0,11,Monday,1
😈 Innovative Hacking Technique 😱🤯🙀,2024-02-11 17:00:18+00:00,PT1M,113252,10469,61,60.0,17,Sunday,1
How Hackers Hack using Gmail (Innovative) 🔥,2024-02-11 11:30:30+00:00,PT9M16S,134595,3897,260,556.0,11,Sunday,1
Which Code Editor to Use?,2024-02-09 16:30:05+00:00,PT39S,228791,14540,195,39.0,16,Friday,1
Exercise 18 - Solution & Shoutouts | Sigma Web Development Course - Tutorial #113,2024-02-08 16:14:04+00:00,PT13M19S,62725,2377,331,799.0,16,Thursday,1
Handling Events in React | Sigma Web Development Course - Tutorial #112,2024-02-07 17:05:50+00:00,PT16M35S,88811,3321,318,995.0,17,Wednesday,1
👨‍💻 Should Kids learn Coding?,2024-02-07 07:14:21+00:00,PT36S,145044,10272,174,36.0,7,Wednesday,1
Exercise 18 - Display the Cards | Sigma Web Development Course - Tutorial #111,2024-02-06 16:09:04+00:00,PT6M11S,63829,2645,331,371.0,16,Tuesday,1
Conditional Rendering  & Rendering Lists in React | Sigma Web Development Course - Tutorial #110,2024-02-05 15:43:53+00:00,PT19M6S,103241,3366,336,1146.0,15,Monday,1
"Let’s Build a Tech Blog using HTML, Tailwind CSS, React, and Appwrite Cloud as a backend 🔥",2024-02-04 15:30:04+00:00,PT43M26S,49105,1630,151,2606.0,15,Sunday,1
